{
  "$schema": "https://json-schema.org/draft/2020-12/schema",
  "$id": "https://www.mergecore.dev/schemas/go-rules.schema.json",
  "title": "MergeCore Go rules pack",
  "type": "object",
  "required": [
    "meta",
    "severity_levels",
    "scoring",
    "rules"
  ],
  "properties": {
    "meta": {
      "type": "object",
      "required": [
        "pack_version",
        "locale"
      ],
      "properties": {
        "pack_id": {
          "type": "string"
        },
        "pack_version": {
          "type": "string"
        },
        "locale": {
          "type": "string"
        },
        "title": {
          "type": "string"
        },
        "description": {
          "type": "string"
        },
        "notes": {
          "type": "string"
        }
      }
    },
    "severity_levels": {
      "type": "object",
      "additionalProperties": {
        "type": "object",
        "properties": {
          "rank": {
            "type": "integer",
            "minimum": 0
          },
          "label": {
            "type": "string"
          },
          "default_penalty": {
            "type": "number",
            "minimum": 0
          }
        }
      }
    },
    "scoring": {
      "type": "object"
    },
    "rules": {
      "type": "array",
      "items": {
        "type": "object",
        "required": [
          "id",
          "category",
          "severity",
          "quality_signal",
          "title"
        ],
        "properties": {
          "id": {
            "type": "string",
            "pattern": "^[A-Z0-9\\-]+$"
          },
          "category": {
            "type": "string"
          },
          "severity": {
            "type": "string"
          },
          "quality_signal": {
            "type": "string",
            "enum": [
              "junior",
              "risky",
              "overengineered",
              "senior_positive"
            ]
          },
          "title": {
            "type": "string"
          },
          "description": {
            "type": "string"
          },
          "penalty": {
            "type": "number",
            "description": "Score delta applied when the rule fires. Negative values are bonuses (typically paired with quality_signal=senior_positive)."
          },
          "detection": {
            "type": "object"
          },
          "examples": {
            "type": "object"
          }
        }
      }
    }
  }
}
